Sheet: Sheet2
A1: Field | B1: Size (bits) | D1: Description
A2: Type of Data | B2: 8 bits (1 byte) | D2: Identifies type (0-255)
A3: Game ID | B3: 8 bits (1 byte) | D3: Game identifier (0-255)
A4: Timestamp | B4: 16 bits (2 bytes) | D4: Frame timestamp (0-65535)
A6: Player Data (Without Effects)
A8: Field | B8: Size (bits) | C8: Size (bits) | D8: Description
A9: Player ID | B9: 10 bits | C9: 10 bits | D9: Player identifier (e.g., session ID, 0-1023)
A10: Health | B10: 8 bits (1 byte) | C10: 8 bits (1 byte) | D10: Player health (0-255)
A11: Armor | B11: 8 bits (1 byte) | C11: 8 bits (1 byte) | D11: Armor level (0-255)
A12: Position (Vector3D) | B12: 18 bits (6 bits each for x, y, z) | C12: 18 bits (6 bits each for x, y, z) | D12: Player’s 3D position (scaled)
A13: Velocity (Vector3D) | B13: 18 bits (6 bits each for x, y, z) | C13: 18 bits (6 bits each for x, y, z) | D13: Player’s velocity in 3D space
A14: Perspective Angle (Vector2D) | B14: 16 bits (8 bits each for x, y) | C14: 16 bits (8 bits each for x, y) | D14: View angle for aiming
A15: Rotation Angle (Vector2D) | B15: 16 bits (8 bits each for x, y) | C15: 16 bits (8 bits each for x, y) | D15: Rotation angle
A16: Player Status | B16: 16 bits (2 bytes) | C16: 16 bits (2 bytes) | D16: Various boolean status flags (isAlive, isRunning, etc.)
A17: Kill Count | B17: 12 bits | C17: 12 bits | D17: Kill counter (0-4095)
A18: Death Count | B18: 9 bits | C18: 9 bits | D18: Death counter (0-511)
A19: Ping | B19: 8 bits (1 byte) | C19: 8 bits (1 byte) | D19: Network latency (0-255ms)
A20: Stamina | B20: 7 bits | C20: 7 bits | D20: Stamina level (0-127)
A21: Player Team | B21: 8 bits (1 byte) | C21: 8 bits (1 byte) | D21: Team ID (0-255)
A22: Throwables Count | B22: 8 bits (1 byte) | C22: 8 bits (1 byte) | D22: Count of grenades or throwable items
A23: Assets Count | B23: 8 bits (1 byte) | C23: 8 bits (1 byte) | D23: Number of assets or equipment player has
A25: Effects and Actions (Player)
A27: Field | B27: Size (bits) | D27: Description
A28: Actions | B28: 8 bits (1 byte) | D28: Flags for specific player actions (8 different actions)
A29: Effects (Boosts) | B29: 8 bits (1 byte) | D29: Effects like speed boost, shield (buffs)
A30: Effects Info | B30: 8 bits (1 byte) | D30: Other info like time remaining, effect strength
A32: Vector Types
A34: Type | B34: Size (bits) | D34: Description
A35: Vector3D | B35: 6 bits per axis | D35: Used for position and velocity (18 bits total)
A36: Vector2D | B36: 8 bits per axis | D36: Used for angles (16 bits total)
A38: Player Status Flags (Detailed Breakdown)
A40: Status Flag | B40: Size (bits) | D40: Description
A41: isAlive | B41: 1 | D41: Whether the player is alive
A42: isSpectator | B42: 1 | D42: Whether the player is spectating
A43: isBot | B43: 1 | D43: AI bot status
A44: isSprinting | B44: 1 | D44: Sprinting status
A45: isReloading | B45: 1 | D45: Reloading weapon
A46: isCrouching | B46: 1 | D46: Crouching status
A47: isGrounded | B47: 1 | D47: Player is on the ground
A48: isAiming | B48: 1 | D48: Aiming down sights
A49: isZooming | B49: 1 | D49: Player is zoomed in (sniper, etc.)
A50: isWalking | B50: 1 | D50: Walking state
A51: isRunning | B51: 1 | D51: Running state
A52: isStunned | B52: 1 | D52: Player is stunned
A53: isDashing | B53: 1 | D53: Dashing state
A54: isDead | B54: 1 | D54: Dead state
A55: isOnGround | B55: 1 | D55: On the ground
A56: isOnWall | B56: 1 | D56: Player is on the wall (e.g., climbing)
A57: isOnLadder | B57: 1 | D57: On a ladder
A58: isOnObject | B58: 1 | D58: Interacting with an object
A59: isOnSlope | B59: 1 | D59: Player is on a slope
A60: isOnWater | B60: 1 | D60: In water
A61: isOnLedge | B61: 1 | D61: On a ledge
A62: isOnBridge | B62: 1 | D62: On a bridge
A63: isOnBuilding | B63: 1 | D63: On top of a building
A64: isOnTree | B64: 1 | D64: On a tree
A65: isOnStair | B65: 1 | D65: On stairs
A66: isOnRail | B66: 1 | D66: On a rail
A67: isOnPlatform | B67: 1 | D67: On a moving platform
A68: isOnTrain | B68: 1 | D68: On a moving train
B69: =SUM(R[-28]C:R[-1]C) -> 28

Sheet: 32Bpack
A1: Common Game Data
J2: =IMLOG2(PRODUCT(C[-7]))/8 -> 34.5
A3: Field | B3: Size (bits) | C3: Range | D3: Description
A4: Type of Data | B4: 8 | C4: =2^RC[-1] -> 256 | D4: Type identifier for data packets.
A5: Game ID | B5: 8 | C5: =2^RC[-1] -> 256 | D5: Game identifier.
A6: Timestamp | B6: 32 | C6: =2^RC[-1] -> 4294967296 | D6: Timestamp for the current state.
A7: Player ID | B7: 10 | C7: =2^RC[-1] -> 1024 | D7: Player connection or session ID.
A9: Player Data | E9: =SUM(R[-5]C[-3]:R[-2]C[-3]) -> 58
A11: Basic Player Data
A13: Field | B13: Size (bits) | C13: Range | D13: Description
A14: Health | B14: 8 | C14: =2^RC[-1] -> 256 | D14: Player health.
A15: Armor | B15: 8 | C15: =2^RC[-1] -> 256 | D15: Player armor level.
A16: Kill Count | B16: 12 | C16: =2^RC[-1] -> 4096 | D16: Number of kills.
A17: Assest count | B17: 0
A18: Death Count | B18: 9 | C18: =2^RC[-1] -> 512 | D18: Number of deaths.
A19: status | B19: =R[39]C[3] -> 11 | C19: =2^RC[-1] -> 2048 | D19: Player Status
A20: Player Velocity | B20: =R[13]C[3] -> 24 | C20: =2^RC[-1] -> 16777216 | D20: Player Velocity
A21: Player Possition | B21: =R[12]C[3] -> 24 | C21: =2^RC[-1] -> 16777216 | D21: Player Possition
A22: TimeStamp | B22: 0 | C22: =2^RC[-1] -> 1 | D22: mentioned above
A23: Ping | B23: 8 | C23: =2^RC[-1] -> 256 | D23: Player ping (latency).
A24: Stamina | B24: 7 | C24: =2^RC[-1] -> 128 | D24: Stamina value.
A26: Vector3D: | E26: =SUM(R[-12]C[-3]:R[-2]C[-3]) -> 111
A28: Field | B28: Size (bits) | C28: Range | D28: Description
A29: X | B29: 8 | C29: =2^RC[-1] -> 256 | D29: X-component of player velocity.
A30: Y | B30: 8 | C30: =2^RC[-1] -> 256 | D30: Y-component of player velocity.
A31: Z | B31: 8 | C31: =2^RC[-1] -> 256 | D31: Z-component of player velocity.
A33: Vector2D | E33: =SUM(R[-4]C[-3]:R[-2]C[-3]) -> 24
A35: Field | B35: Size (bits) | C35: Range | D35: Description
A36: X | B36: 8 | C36: =2^RC[-1] -> 256 | D36: X-angle of the player’s rotation.
A37: Y | B37: 8 | C37: =2^RC[-1] -> 256 | D37: Y-angle of the player’s rotation.
A39: Player Status (2 Bytes / 16 bits) | E39: =SUM(R[-3]C[-3]:R[-2]C[-3]) -> 16
A41: Field | B41: Size (bits) | C41: Range | D41: Description
A42: Is Dead | B42: 1 | C42: =2^RC[-1] -> 2 | D42: Whether the player is alive.
A43: Is Spectator | B43: 1 | C43: =2^RC[-1] -> 2 | D43: Whether the player is a spectator.
A44: Is Bot | B44: 1 | C44: =2^RC[-1] -> 2 | D44: Whether the player is a bot.
A45: Is Sprinting | B45: 1 | C45: =2^RC[-1] -> 2 | D45: Whether the player is sprinting.
A46: Is Crouching | B46: 1 | C46: =2^RC[-1] -> 2 | D46: Whether the player is crouching.
A47: Is Reloading | B47: 1 | C47: =2^RC[-1] -> 2 | D47: Whether the player is reloading.
A48: Is Grounded | B48: 0 | C48: =2^RC[-1] -> 1 | D48: Whether the player is on the ground.
A49: Is Aiming | B49: 1 | C49: =2^RC[-1] -> 2 | D49: Whether the player is aiming.
A50: Is Zooming | B50: 1 | C50: =2^RC[-1] -> 2 | D50: Whether the player is zooming in.
A51: Is Walking | B51: 1 | C51: =2^RC[-1] -> 2 | D51: Whether the player is walking.
A52: Is Running | B52: 1 | C52: =2^RC[-1] -> 2 | D52: Whether the player is running.
A53: Is Stunned | B53: 1 | C53: =2^RC[-1] -> 2 | D53: Whether the player is stunned.
A55: Is Dashing | B55: 0 | C55: =2^RC[-1] -> 1 | D55: Whether the player is dashing.
A56: Is On Ground | B56: 0 | C56: =2^RC[-1] -> 1 | D56: Whether the player is on the ground (again for fallback).
A58: Player Effects (4 Bytes / 32 bits) | E58: =SUM(R[-16]C[-3]:R[-2]C[-3]) -> 11
A60: Field | B60: Size (bits) | C60: Range | D60: Description
A61: Action States | B61: 8 | C61: =2^RC[-1] -> 256 | D61: bitfield of player actions (e.g., shooting, jumping).
A62: Power-ups | B62: 8 | C62: =2^RC[-1] -> 256 | D62: Power-up state (e.g., speed boost, shield).
A63: Effect Duration | B63: 8 | C63: =2^RC[-1] -> 256 | D63: Remaining time for the active effect (in seconds).
A64: Effect Intensity | B64: 8 | C64: =2^RC[-1] -> 256 | D64: Intensity or strength of the effect (e.g., shield power).
A66: Extended Player Data (3 Bytes / 24 bits) | E66: =SUM(R[-5]C[-3]:R[-2]C[-3]) -> 32
A68: Field | B68: Size (bits) | C68: Range | D68: Description
A69: Team ID | B69: 8 | C69: =2^RC[-1] -> 256 | D69: Team identifier for team-based games.
A70: Throwable Count | B70: 8 | C70: =2^RC[-1] -> 256 | D70: Number of throwables like grenades.
A71: Asset Count | B71: 8 | C71: =2^RC[-1] -> 256 | D71: Number of assets the player currently holds.
A74: Summary:
A76: Total Size | B76: Bytes (bits) | C76: Range | D76: Description
A77: Common Game Data | B77: =R[-68]C[3] -> 58 | D77: Basic game-related data.
A78: Player Data | B78: =R[-52]C[3] -> 111 | D78: Contains player position, status, and key gameplay data.
A79: Effects | B79: 32 | D79: Tracks player effects such as power-ups and actions.
A80: Extended Player | B80: 24 | D80: Additional player-specific data (team, throwables).
A81: Total | B81: =SUM(R[-4]C:R[-1]C) -> 225 | C81: bits | D81: Total for each player update.
A82: Mapping bit Mask for bytes | B82: 25 | D82: bitmask for all with out this (when a byte represent as 0 that byte removed in this method)
A83: net Total | B83: =(R[-2]C+R[-1]C)/8 -> 31.25 | C83: Bytes
B84: =32-R[-1]C -> 0.75 | C84: Bytes left to 32 | D84: =RC[-2]*8 -> 6 | E84: bits
D85: CheckSum ^^ for divided full string bytesum by | E85: =POWER(2,R[-1]C[-1]) -> 64
A95: "- a string of 32 byte thats only update player’s information on server Compression Techniques: - escape by -This method resurves bits. This canbe improved by resuving the multliplication of ranges. whitch will be so much more space efficiant(as expected).